{
  "gate_report": {
    "file": "evidence/release/foss-mcp-serving__demo-4e5804b--720af656.gate-report.json",
    "image_id": "sha256:59201c67d97afcc39f90ff7ba8a11b13245f156fe0a89708491c9f6df7c54fcd",
    "memory_budget": "256m",
    "peak_memory_mb": 77.49,
    "pilots_passed": 40,
    "pilots_total": 40,
    "sha256": "37e3f75be9f7e6e673f394801ec9aa874da07b14df426dddecaafdcb149bad33",
    "verdict": "PASS"
  },
  "generated_by": "gatectl",
  "image": {
    "created": "2026-10-16T14:21:07.53261668Z",
    "image_id": "sha256:59201c67d97afcc39f90ff7ba8a11b13245f156fe0a89708491c9f6df7c54fcd",
    "reference": "foss-mcp-serving:demo-4e5804b",
    "size_bytes": 387545255,
    "source_commit": "4e5804bbadbb60f1e8aa952c594b255fc4d70a8f"
  },
  "recorded_at": "2026-10-16T14:31:41Z",
  "registry": null,
  "schema_version": 1,
  "status": "LOCAL_ONLY"
}
