{
  "gate_report": {
    "file": "evidence/release/foss-mcp-serving__demo-cbbd93e--8910d6c1.gate-report.json",
    "image_id": "sha256:5adc520de228a4e1a5461c89a93c334ded179b0630a66a877d39a9e44481a075",
    "memory_budget": "256m",
    "peak_memory_mb": 72.55,
    "pilots_passed": 40,
    "pilots_total": 40,
    "sha256": "3c41e3063bae21a5f5d7facb8e2512599a7a62c9b3352ae7dcf07506f1168be1",
    "verdict": "PASS"
  },
  "generated_by": "gatectl",
  "image": {
    "created": "2026-10-14T19:06:10.401166029Z",
    "image_id": "sha256:5adc520de228a4e1a5461c89a93c334ded179b0630a66a877d39a9e44481a075",
    "reference": "foss-mcp-serving:demo-cbbd93e",
    "size_bytes": 387099617,
    "source_commit": "cbbd93e1b15fc062eacd47ab4ae094f78c868be1"
  },
  "recorded_at": "2026-10-14T19:29:00Z",
  "registry": null,
  "schema_version": 1,
  "status": "LOCAL_ONLY"
}
